{
  "branchId": "bosonic-validation-001",
  "schemaVersion": "1.0.0",
  "sourceEquationRevision": "manuscript-r1",
  "codeRevision": "phase4-p4c3",
  "activeGeometryBranch": "simplicial-patch-v1",
  "activeObservationBranch": "sigma-pullback-v1",
  "activeTorsionBranch": "augmented-torsion-v1",
  "activeShiabBranch": "identity-shiab-v1",
  "activeGaugeStrategy": "penalty",
  "baseDimension": 3,
  "ambientDimension": 9,
  "differentialFormMetricId": "hodge-standard",
  "lieAlgebraId": "su2",
  "basisConventionId": "standard-basis",
  "componentOrderId": "lexicographic",
  "adjointConventionId": "killing-form",
  "pairingConventionId": "trace-pairing",
  "normConventionId": "L2-norm",
  "insertedAssumptionIds": ["IA-1", "IA-2", "IA-3", "IA-4", "IA-5", "IA-6"],
  "insertedChoiceIds": ["IX-1", "IX-2", "IX-3", "IX-4", "IX-5"],
  "parameters": {
    "gaugePenaltyWeight": "1.0",
    "solverMaxIter": "50"
  }
}
